start	end	text
3688960	3695960	And you cannot, the Iranians cannot build them on their own, on the Caspian, on their coast of the Caspian Sea.
3695960	3702960	So they would have to bring them via the river and channel systems of Russia from the Black Sea and so on.
3702960	3704960	You know this better than me.
3704960	3708960	So the Russians wouldn't let them. They wouldn't let them.
3708960	3711960	So this is the problem number one for the Iranians.
3711960	3723960	Problem number two, I said, every single major arms deal between Moscow and Tehran in the last 30 years, was messed up by the Russians.
3723960	3731960	There would be an agreement, a contract was signed, Iranians would pay 50% advance and nothing happened.
3731960	3738960	All the Russia, or if something happened, the Russians would deliver something entirely different than the Iranians have ordered.
3738960	3745960	That means, for example, the Iranians have ordered S-300 air defense systems, long-range air defense systems.
3745960	3751960	Russians delivered Tor, short-range air defense systems and such things.
3751960	3760960	And in some cases, for example, the Iranians, in one case, they went to Moscow and said, look, we want MiG-31s.
3760960	3768960	Here is one billion for them, right on the table, deliver them in one or two years whenever.
3768960	3774960	The Russians pocketed money and did nothing.
3774960	3785960	And then two years later, after lots of complaints from Tehran, the Russians delivered yet more tours and books and such things instead.
3785960	3791960	So why should Iranians trust them? They have no reason.
3791960	3798960	Shahid's UAVs, attack UAVs, was an exception from the rule. Why?
3798960	3807960	Because the Russians were so stupid to pay for something that is worth, perhaps, $5,000 to pay $200,000 per single Shahid.
3807960	3809960	Your own hackers have found this out.
3809960	3815960	So it was a brilliant opportunity, not in special, you know, no high technology from China, actually.
3815960	3819960	Okay, let them have it. We are cashing millions from this.
3819960	3822960	And that is why Russians have such weaponry.
3822960	3828960	But other Iranian weaponry, I haven't seen anything of that kind in Russia.
3828960	3836960	I've seen mortars and mortar shells of Iranian origins in Ukraine, but not in Russia.
3836960	3839960	So, that much about that.
3839960	3848960	And even if this fat, everybody's calling it ballistic missile, this is not a ballistic missile, this is an artillery rocket.
3848960	3855960	It is similar like BM-27 or BM-30, which Ukraine is also operating, BM-27, not BM-30.
3855960	3857960	And which Russia is already operating.
3857960	3866960	This is a heavy rocket, which is relatively precise and has a range of 100-120 kilometers.
3866960	3874960	Of course, if Iranians would deliver any to Russia, that would be a big problem for Ukraine, because they have a big warhead.
3874960	3884960	And if Iranians would deliver even just a few hundreds of them to Russia, Russian firepower would increase significantly.
3884960	3891960	But so far, I haven't seen an atom of evidence that any have been delivered to Russia.
3891960	3893960	And there is a good reason for this.
3893960	3898960	Because, for example, Iranian Air Force would like to acquire Su-35s.
3898960	3907960	But if the Iranians acquire Su-35s, they do not only want the aircraft, but they want also the capability to maintain this aircraft at home,
3907960	3913960	which in turn means they need the capability to manufacture spare parts for this aircraft at home.
3914960	3920960	And the Russians, this is something the Russians would deliver even to the Chinese, not to talk about Iranians.
3920960	3929960	So, as a bargain for such an eventuality, Iranians are holding back their ballistic missiles.
3929960	3935960	And now, when Iran is almost in a state of war with Israel, even more so.
3935960	3942960	They are not crazy to say, let's sell out our entire missile arsenal to Russia.
3942960	3944960	We are going to earn a few billion.
3944960	3949960	But if they sell off their ballistic missiles, they have nothing to shoot at Israel.
3951960	3958960	Therefore, all of these stories about thousands of Iranian ballistic missiles and blah, blah, blah, blah, to Russia.
3959960	3968960	And finally, after all of this, I said mistrust, bad experiences and so on.
3970960	3978960	Iranians have attempted to enter a sort of strategically alliance with Putin several times.
3978960	3981960	And he has turned them down every single time.
3981960	3987960	They have absolutely no reason to insist on some kind of alliance with him now.
3987960	3988960	Why should they?
3988960	3995960	So, even this story with alliance and whatever else, this is all lots of fantasy and at least as much hysteria.
3995960	4008960	And if nothing else, it's usually used in order to, for some, especially in the West, for some propagating some third point of issues.
4008960	4018960	Like, for example, the first time that there was a talk about the sale of F-35s to Israel, there was promptly a report that Iran is buying 100 S-27s.
4018960	4019960	I mean, which is nonsense.
4019960	4028960	Of course, Iran never bought S-27s, but because it was buying them because of fake news, Israel should get F-35s.
4028960	4029960	No problem.
4029960	4030960	This is how it works.
4031960	4032960	Thank you, Tom.
4032960	4035960	Let's hope they will not deal with each other.
4035960	4041960	Last few questions, and let's try to cover them shortly.
4041960	4048960	The first one, will Russian Federation complete the railway to Crimea this year?
4049960	4050960	Yes.
4050960	4052960	Isn't it already to Melitopol?
4054960	4055960	I'm not sure.
4055960	4056960	I'm not sure.
4056960	4062960	Do you think that this will cause huge consequences for us?
4062960	4063960	Of course.
4063960	4064960	Of course.
4065960	4067960	Railway from what is the place?
4067960	4074960	Niprov down to Melitopol, for example, that's making things massively easier for the Russians.
4074960	4076960	I do not need the Kerch Bridge anymore.
4077960	4083960	They can transport, what, 5000 kg, 5000 tons, sorry, a day to Melitopol.
4084960	4085960	It's perfect for them.
4086960	4091960	And the Ukrainians can, of course, try to hit that with my missiles and so on and so on,
4091960	4094960	but the Russians have it easier to repair a railway,
4094960	4099960	then it's much more complicated to repair a bridge instead.
4099960	4102960	So it is a perfect solution for them.
4103960	4104960	Thank you.
4104960	4111960	Regarding the bridge, what do you think, is it possible to destroy the Crimean Bridge with missiles?
4112960	4118960	With missiles alone, not really.
4119960	4126960	You can damage it temporarily, close it for a few weeks or even for two months, and that's it.
4126960	4130960	But you really need big missiles and really have to hit,
4130960	4134960	a very precise hit in a specific part of the construction.
4134960	4137960	You mean ballistic missiles, not cruise missiles?
4137960	4138960	Ballistic missiles, yes.
4138960	4139960	No, no cruise missiles.
4139960	4141960	No, no cruise missiles, okay.
4141960	4143960	I mean, it doesn't matter.
4143960	4148960	You need something like a 2000 kg warhead and this must be extremely precise
4148960	4153960	and hitting this particular part of the construction in order to drop a bridge.
4153960	4159960	It is pointless to hit the middle of the bridge because you're just going to create a gap in the road.
4159960	4160960	Nothing is going to happen.
4160960	4166960	We have seen this on so many other examples, Antonovsky Bridge, almost two years ago.
4166960	4175960	So, excuse me, right now I don't see Ukraine having an ability to drop the catch bridge.
4177960	4178960	Okay, thank you.
4178960	4180960	Tom, we have the last question.
4180960	4186960	You recently described the scenario for ending the war in the Middle East.
4186960	4190960	You yourself called it almost fantastic.
4190960	4192960	Yeah, it is fantasy, yes.
4192960	4199960	Yes, so could you please describe more or less realistic scenario for ending the war in Ukraine?
4199960	4202960	No, I can't because I have no idea how to end it.
4202960	4207960	I mean, there is so much reform necessary alone in Ukraine.
4207960	4214960	You would need to reorganize the way your government is thinking, not only to say acting.
4214960	4218960	You would need to bring your population all to one side and say,
4218960	4221960	guys, we are really in danger of extermination.
4221960	4227960	If you are sitting at home and watching TV, you are screwing up all of you, all of us.
4227960	4229960	You don't even have this psychology.
4229960	4234960	I mean, okay, you have lots of volunteers and people are really trying to help the country and so on.
4234960	4239960	But a big part of the population is just sitting there and doing nothing for Ukraine.
4240960	4248960	Then, as next, you would have to understand that you need many more women in your armed forces in your industry and so on and so on.
4248960	4252960	I cannot understand that you still have unemployed people at war.
4252960	4255960	You have unemployed people in Ukraine. How can this happen?
4255960	4262960	I said, your defense sector is idling around working at 40% to 60% of capacity.
4263960	4273960	And even if it would certainly like to work at higher capacity, but it can't because the government does not have the money for that.
4273960	4278960	And so you have serious problems, very extensive problems with you.
4278960	4282960	I have no idea how to solve all of this.
4282960	4286960	So therefore, I have no clear idea how can you solve the problem.
4286960	4297960	Ideally, you would manufacture, let's say, 500 to 1000 tanks a year and then you would manufacture a similar number of heavy infantry fighting vehicles.
4297960	4301960	That means vehicles as well armored as tanks.
4301960	4309960	You would manufacture not one million FPV drones a year, but five million of them.
4309960	4312960	You would have enough pilots and crews for all of this.
4312960	4314960	You would equip your entire armed forces.
4314960	4323960	You would have, ideally, you would have enough artillery ammunition and even more important, you would have such missiles like FAT or rockets.
4323960	4331960	Actually, sorry, artillery rockets like FAT, which means you can deliver a warhead of 100, 200, 300 kilogram over range of 100 kilometers.
4331960	4341960	Ideally, you would need something like 20, at least 20 Patriots and batteries, plus a similar number of IST and 70.
4341960	4350960	If you are empty, you don't have anything of this and I don't see you getting anything of this, but even enough to patch up your air defenses and so on and so on.
4350960	4353960	So I have no solution right now.
4353960	4365960	What you need is plenty of firepower and I mean really firepower in terms of 100, 200, 300 kilogram warheads being delivered and obliterating entire Russian units.
4365960	4368960	This is happening perhaps once a month, but this is too little.
4368960	4370960	You would need this happening every single day.
4370960	4377960	I also do not understand, I mean, how long is it now that you have got the first high mass that was in summer 2022?
4377960	4382960	So two years and you're still not manufacturing high mass at home?
4382960	4384960	I cannot understand this.
4384960	4385960	Why not?
4385960	4391960	You're all the time waiting for Americans to have mercy and send you another 30 rockets.
4391960	4392960	Aether comes.
4392960	4398960	Why is nobody manufacturing aether comes in Ukraine?
4398960	4399960	Out of mind of what?
4399960	4411960	Instead, the government has been, as far as I have heard, is letting the Americans buy agricultural surfaces, real estate.
4411960	4417960	I mean, it's not letting them buy directly, but it says okay, if some foreigner wants to buy it, let's do it.
4417960	4420960	And Ukrainians don't have the money to do so, so foreigners are buying it.
4420960	4425960	And the first foreigners who are doing it in the soil are the Americans.
4426960	4429960	So you're going to end as what?
4429960	4434960	A heavily indebted, lucky home territory?
4434960	4436960	I don't know where is this heading.
4436960	4439960	I have no solution for this problem, excuse me.
4439960	4444960	I mean, Middle East is perfect in comparison.
4444960	4445960	Thank you, Tom.
4445960	4451960	I hope our audience will make the appropriate conclusions from your words.
4451960	4460960	And at the end, I would just mention that we're not publishing all of Tom's texts.
4460960	4468960	That's, I'm talking to our audience, all of Tom's texts for different reasons.
4468960	4483960	But if you are looking for an interesting, competent overview of the events in the Middle East,
4483960	4489960	I would probably suggest you to take a look at Tom's blog,
4489960	4497960	because I believe that a person who spent almost 40 years studying this region
4497960	4507960	probably knows a bit more comparing to those experts you are watching on our TV.
4507960	4510960	So thank you so much, Tom.
4510960	4521960	It was a big pleasure to talk to you and they hope we will have another interview a bit later.
4521960	4524960	Thank you very much for inviting me as well.
4524960	4532960	And please keep yourself safe and do the best for your country and for all of you.
4532960	4533960	Thank you, Tom.
4533960	4535960	Goodbye, everyone.
4535960	4536960	Stay safe.
4536960	4537960	Goodbye.
