start	end	text
1920960	1933960	To remain in the south. Well, basically, they need not attacking in the south, they need not attacking Southern Zaporozhia because everything is doing along their ideas in the east.
1933960	1946960	So why attacking where they are not going to get to as we have seen this summer in Robotinia area, for example, in what is that?
1946960	1956960	Excuse me, just a check to map. South of Velikonovo, Silka, in Urogyne, for example, okay, they have captured Urogyne, but they cannot hold it.
1956960	1966960	Why wasting their resources by deploying them somewhere else if they are successful in the east? And they are successful in the east.
1966960	1973960	So can I conclude that the situation for Kerson will remain the same for the next year?
1973960	1982960	For the next year and a half, as long as not something substantial happens in Kiev, for example.
1982960	1988960	Thank you, Tom. Let's move to the second chapter, which is called Air War.
1988960	1998960	And the first question will be about Russian Cubs, guided bombs.
1998960	2009960	There are reports that Russia has increased the range of its Cubs from 30 kilometers to up to even 80 kilometers.
2009960	2014960	And the question is how much further can this range be increased?
2014960	2022960	Okay, first start. Russia didn't increase the range. The range was 60 to 70 kilometers already last year.
2022960	2030960	This is simply physics. And this physics comes from the weight of the weapon combined with the speed of the aircraft carrying it.
2030960	2038960	At the time it's released, plus the attitude of the aircraft at the time it's released the bomb.
2038960	2050960	So what happens, SO-34 comes in at an altitude between 9,000 and 12,000 meters at a high subsonic speed.
2050960	2057960	Which means something like 1,100 kilometers per hour.
2057960	2063960	So then it enters a shallow claim and it flies like this and releases the bomb.
2063960	2077960	The bombs drop from the aircraft, open their wings and then they glide over 60 to 70 kilometers in a parabolic trajectory until hitting the ground.
2077960	2085960	So the point is now the following. Depending on the sector of the front line where they deploy such bombs,
2085960	2093960	in some cases Russians are free to fly their SO-34s all the way over the Ukrainian positions.
2093960	2098960	For example, in Wuchleda area the last two weeks they were free to fly over Wuchleda.
2098960	2107960	Because the glorious general staff of Ukrainian armed forces didn't take care to deploy at least proper air defenses of that place.
2107960	2114960	Therefore, they could reach 70 kilometers behind Wuchleda.
2114960	2123960	But in other sectors, for example Kursk, they can't.
2123960	2136960	In Kursk the Ukrainian air defenses are strong enough that the Russians have to release their bombs from 70 kilometers away from, let's say, 50 kilometers behind their front line.
2136960	2142960	To reach a target only 20 kilometers behind the Ukrainian front line, 10 to 20 kilometers behind the Ukrainian front line.
2142960	2148960	And then it appears to plenty of people that the range is shorter than just 30 kilometers.
2148960	2155960	In other cases, the Russians do not need to hit something that is further away than 30 kilometers.
2155960	2159960	So they are releasing their bombs and they are striking targets just 30 kilometers away.
2159960	2164960	Because the target is simply closer and less well protected.
2164960	2169960	So, correspondingly, the range was always 60 to 70 kilometers.
2169960	2175960	And now it might be increased to around 100 kilometers with help of rocket boosters.
2175960	2182960	That means there is a rocket engine, rocket motor, sorry, installed on the rear, at the rear of the UMPK.
2182960	2190960	And this is then powering the bomb and instead of glide bomb it's becoming a guided missile de facto.
2190960	2193960	So that is the answer to your question.
2193960	2196960	That's clear, Tom.
2196960	2210960	Is it true that Russians already developed not far-flying Cubs but also more powerful Cubs?
2210960	2214960	I mean that more heavier ones.
2214960	2226960	For example, everyone knows about Cup 500 but some people already say about Cup 900 or something like that.
2226960	2229960	Okay, let me clarify this.
2229960	2234960	In the Soviet and therefore Russian Air Force you have specific calibers of bombs.
2234960	2243960	250 kilogram, 500 kilogram, 1,500 kilogram, 3,000, 5,000 and 9,000 kilogram bombs.
2243960	2245960	Okay, these are the biggest bombs.
2245960	2252960	A FAB, Fugas, an aviation bomb, 5,000, 9,000 was the biggest one.
2252960	2259960	And this 9,000 means it is 9,000 kilogram heavy or somewhere like that.
2259960	2270960	So correspondingly, for 9,000 kilogram bomb you need a bomb which can carry a bomb weighting 9 tons.
2270960	2272960	That is the first point.
2272960	2280960	The second point is in order to make a glide bomb out of such a bomb you need very big wings, big wing surface.
2280960	2284960	And the bigger the wing surface, the further it's flying.
2284960	2292960	Which in turn means you need the bomb itself is getting ever grow bigger and bigger.
2292960	2301960	Correspondingly, there is a big problem already with the bomb in caliber of 3,000 kilogram of 3 tons.
2302960	2311960	The construction, this UMP key construction, this module which is installed on top of the bomb is splitting wings.
2311960	2313960	So it becomes a glide bomb.
2313960	2318960	It's so big and so heavy that the bomb is weighting something like 4 tons.
2318960	2323960	That means that a single SO-34 can only carry one at once.
2323960	2326960	Also because of its sheer size.
2327960	2330960	It is not only the size, it is the weight as well.
2330960	2335960	Because you have to consider you put a 4,000 kilogram bomb under an aircraft.
2335960	2347960	And to connect it to the aircraft you need a hard point, which is we call this pylon in English, which can carry 4,000 kilogram.
2349960	2353960	And this pylon weights another 1,000 kilogram.
2353960	2358960	So now you have 4,000 kilogram of a bomb, 1,000 kilogram of the pylon.
2358960	2363960	And then you put that on the aircraft, on the SO-34, in between the engines.
2363960	2368960	And in this way you have put 4,000 kilogram on the aircraft.
2368960	2374960	SO-34 could theoretically carry 8,000 kilogram of bombs, but then it's going to fly for the next 200 kilometers.
2374960	2383960	But because of the threat of Russian bases, they have moved the SO-34s away from bases close to Ukraine.
2383960	2388960	Therefore they have to fly very far away, from very far away, from the warground in similar places.
2388960	2392960	And therefore they carry only one such bomb at once.
2392960	2394960	So that is theory. Why?
2394960	2402960	Because so far all I've seen, the biggest I've seen as deployed was 1,500 kilogram.
2403960	2406960	You are talking only about Russians or?
2406960	2408960	Russians, Russians, just Russians.
2410960	2412960	1,500 kilogram.
2412960	2416960	It could be that they have dropped one or two 3,000...
2416960	2421960	There are prototypes of 3,000 kilogram heavy UMPK or carb bomb, if you like it.
2421960	2431960	It could be they have deployed two or three of this, but I haven't seen any clear evidence, any definite evidence that there is such a weapon in serious production in Russia.
2432960	2435960	At least not its UMPK module.
2435960	2442960	There are 3,000 kilogram bombs in Russian arsenals and they are in production as well.
2442960	2449960	But there are no UMPK modules which can be installed on such bombs and manufactured in serious.
2449960	2458960	So most of the times they are actually dropping bombs, UMPK bombs or carb bombs, if you like, of 250 kilogram and 500 kilogram.
2458960	2463960	From time to time they are dropping those of 1,500 kilogram.
2463960	2469960	But 3,000 kilogram, I haven't seen clear evidence for any so far.
2469960	2473960	Even somewhere throughout the world, not only in Ukraine?
2476960	2480960	When we are talking about around the world...
2480960	2491960	Yes, the question is, are there any examples of applying such huge stuff, at least somewhere?
2491960	2494960	Maybe on the Middle East or somewhere else?
2494960	2496960	Okay, I see now what you mean.
2496960	2506960	Here we have to distinguish between bombs designed and manufactured, originally manufactured in Soviet Union and nowadays in Russia, and between western bombs.
2506960	2511960	Because western bombs are made of parts which should assemble together as necessary.
2511960	2515960	They are very flexible, they are modular, but they are construction.
2515960	2520960	On Soviet dash Russian bombs, everything is welded together.
2520960	2529960	That's it, bomb is delivered to the air base as it was manufactured, as it was put together already in the factory.
2529960	2531960	You can't change anything about it.
2531960	2547960	So the fundamental question, or the fundamental issue while developing the carb or the UMP key, was how to make a module which you can put on such a bomb which is already ready for use.
2547960	2554960	And this means that every different caliber of bomb needs a different UMP key module.
2554960	2563960	And this module must be ever bigger and bigger because it needs ever bigger wings, so that it can reach these 60 to 70 kilometers.
2563960	2570960	Correspondingly, nobody tried to do anything of this kind outside of Russia.
2570960	2575960	At least not with bombs bigger than 250 kilograms.
2575960	2587960	Most Koreans have a similar system, like UMP key, which is useful for bombs caliber 250, perhaps 500 kilograms.
2587960	2593960	And I've seen them in use by Sudanese Air Force over Yemen, for example.
2593960	2598960	Gosh, this is also 7 years ago or something like that.
2598960	2603960	So this is all I have seen in regards to Soviet dash Russian bombs.
2603960	2614960	Then it comes to western bombs. The situation is entirely different because western bombs are modular and you can put the same kit, so-called kit, on different caliber of bombs.
2614960	2623960	You have bombs caliber 125 kilograms, 250, 500, and 1000, actually not 907, but let's say 1000 kilograms.
2623960	2633960	So you put the same guidance kit and the same set of wings on different caliber of bombs.
2633960	2651960	You can also use specialized casings or bomb bodies, like BLU-109, this is this bunker-buster bomb of 1000 kilogram caliber, or 2000 pounds, as we have seen when Israel assassinated Nasrallah.
2651960	2662960	This is a specially hardened casing, which makes sure that bomb penetrates, you know, goes down to the ground, 20, 30 meters to the ground before detonating.
2662960	2677960	But the guidance system and the wings system for this bomb is still the same like on any general bomb, caliber 250 kilometers, because these bodies are all very flexible and modular.
2677960	2694960	So this is the difference. However, there are no heavier, at least not in widespread tactical service, no heavier air released bombs in western service or of western origin than 1000 kilogram.
2694960	2708960	There is one type, this massive penetrator, whatever, 10,000 kilogram bomb in the United States, but this is carried only by B-2 bombers, and that's it, not a tactical aircraft can deploy it.
2708960	2715960	So the heaviest bombs of this caliber are around 1000 kilograms in the west.
2715960	2724960	Tom, what about Ukraine? Can Ukraine, for example, use our favorite F-16s to apply such stuff?
2724960	2730960	Yes, of course. You could put two 1000 kilogram bombs on F-16.
2730960	2738960	What do you think? Is Ukrainian command going to use it?
2738960	2749960	Yes, you have already underdeveloped such a weapon. I'm just not sure if it is caliber 1000 kilogram, but you certainly have such underdeveloped a weapon of 500 kilogram.
2749960	2767960	That's very interesting. So let's stay on our favorite topic. Tom, how could you, what's your opinion of the using of western aircraft in Ukraine?
2767960	2778960	In order to use western aircraft in Ukraine, you have to change the entire system, how aviation is operating in Ukraine, and this is happening very, very slowly.
2778960	2799960	It took the delivery of F-16s to Ukraine for the top civilian authority in Ukraine, I forgot the name, sorry now, to write a new set of regulations for pilots, for ground personnel, for ground control and so on, and for radar systems and so on.
2799960	2806960	So before that, you still had the same system like in the Soviet Union.
2806960	2820960	So now you have to, in order to use, the next step in using western aircraft is to teach your troops, your ground crews and your pilots to speak English.
2820960	2841960	Which is the next hurdle because despite all the talk about we are going to buy western aircraft, whether a sub-grip pen or F-16s or whatever else, of the last, let's say, 10 years or something like that, nobody in the air force took care to organize English language courses for pilots and for ground personnel.
2841960	2853960	Which means that every time Ukraine sends pilots and ground personnel for training in the west, they first have to spend 6 months, at least, learning English.
2854960	2863960	So now once they learn English, only then can they start training actual flying training or aircraft.
2863960	2879960	Before they start this actual training, flight training on aircraft, they have to learn the basic principles, procedures of flying in the west, which are fundamentally different than those in the former Soviet Union.
2879960	2895960	So even then, actually, they still do not instantly start training on aircraft, but they first learn the procedures and terminology in order to start learning flying aircraft or maintaining aircraft or arming them, refueling them and so on and so on.
2895960	2910960	So you have, every time a new group of Ukrainians is sent to west to learn flying F-16s or whatever else, it takes at least a year to get them so far that they start actually learning to fly the aircraft.
2911960	2924960	Correspondingly, from this point of view, you can instantly calculate how long is it going to take for an entire Ukrainian air force to convert to, let's say, F-16s.
2924960	2926960	This is just F-16s.
2926960	2929960	Another part is going to convert to Gripens.
2929960	2936960	At least a unit is going to fly this sub-AVAC aircraft and similar stuff.
2937960	2942960	So this is a process that is going to take years.
2946960	2957960	Can we say that today is too early to make conclusions about applying F-16s and other aircraft in Ukraine?
2957960	2960960	It's not too early. It's not too early. Don't worry.
2960960	2975960	Let's say, even if the Dutch would junk all of their 40 or whatever F-16s that are still around up on Ukraine tomorrow in the morning, it would still take you one to two years to train enough personnel to fly all of them.
2975960	2977960	You do not have enough people.
2977960	2979960	Someone is already flying.
2979960	2981960	Just flying.
2981960	2982960	Over Ukraine.
2982960	2985960	You don't have enough pilots. You don't have enough ground personnel.
2985960	2989960	You don't have the support infrastructure. You don't have the spares.
2989960	2995960	You don't have maintenance facilities in Ukraine. You don't have it. It's simply not there.
2995960	3007960	So you mean that those aircraft which already fly above Ukraine, they do not conduct any military mission?
3007960	3008960	Oh, no. I do not say that.
3008960	3009960	What do they do?
3009960	3018960	There are five F-16s in Ukraine. This is the group that was delivered, what is it, two months ago, and they are flying air combat sorties.
3018960	3023960	Air defense sorties. I'm not dispute about this.
3023960	3038960	But increasing this number to, let's say, 30 or something, to something meaningful, you know, to a number that is making sense or having its effect upon developments on the battlefield.
3038960	3040960	It's going to take its time.
3040960	3043960	Okay. That's clear.
3043960	3054960	We also had a question that is being asked throughout Ukraine for about three years.
3054960	3063960	Why don't we still have our own iron dome above Ukraine?
3063960	3067960	What's about Ukrainian air defense?
3067960	3073960	Yeah. Where should I start?
3073960	3079960	Well, I mean, you are Ukrainian. You know it better than me. You grew up in Ukraine, if nothing else. I've never been to Ukraine.
3079960	3091960	The first problem is that from the independence in 1991, 1992, until 2014, nobody cared about Ukrainian armed forces.
3091960	3095960	So they were constantly decreasing, decreasing, decreasing, decreasing, downsizing, downsizing.
3095960	3103960	Units were constantly disbanded. Air bases were closed. Nobody needed armed forces.
3103960	3107960	There was peace everywhere. Everything was so beautiful.
3107960	3114960	And well, it's a matter of fact that Ukrainian economy wasn't particularly good.
3114960	3119960	So you had a situation where there was no money for armed forces either.
3119960	3128960	And therefore, although you had excellent companies which could design a manufacturing weaponry, nobody was buying this weaponry.
3128960	3134960	And so these companies, in some cases, ended working for the Russians, and not only a few of them.
3134960	3145960	So when the Russians needed some kind of tactical-guided weapons, air-to-air missiles and so on, these were made, or at least major parts of them,
3145960	3156960	major assemblies of them were made in Ukraine. And then the Russians would either use these at home or sell them abroad, export them to whatever customers.
3156960	3164960	So now the 2014 came, and there are lots of announcements and blah, blah, blah, blah, blah, and nothing happened.
3164960	3174960	Well, the most that has happened was to overhaul MiG-29s and S-25s and S-24s, very few S-24s, S-27s.
3174960	3184960	So they were overhauled. That means that they were taken apart, cleaned, refurbished, most important pieces were replaced.
3184960	3192960	Then everything was assembled, painted anew, and they received a new radio, they received new weapons management systems.
3192960	3199960	MiG-29s have even received this new computer, which is improving the performance of their radar. Beautiful.
3199960	3207960	And that's it. Nobody came to the idea, obviously, to finance the installation of development research and installation of,
3207960	3215960	or actually serious production and installation of new air-to-air missiles on MiG-29s or S-27s.
3215960	3226960	So this is the first point. The second point is, in order to have such weaponry, whether air-to-air missiles or surface-to-air missiles,
3226960	3231960	you should have had somebody who would manufacture them.
3231960	3247960	Basically, you had several design bureaus like Luch, for example, who have designs of new air-to-air missile and its surface-launched version,
3247960	3256960	with a range of something like 100 kilometers, which is something which your armed forces would need urgently right now,
3256960	3262960	and then not in a few examples, but in thousands. But it's not there. Why?
3262960	3271960	Well, because, obviously, somebody there is convinced that these are old companies, that they are too complex and they're wasting too much money
3271960	3277960	and doing nothing and they're useful and whatever else, therefore nothing is done.
3277960	3287960	And now, even if Luch would start, or actually give Artyom the production to launch this production, the serious production of this new weaponry,
3287960	3297960	it would take at least a year to introduce it to service. On the other side, meanwhile, Artyom was heavily hit several times by the Russians this summer,
3297960	3302960	so I don't even know how much of its underground facilities are still actually operational.
3302960	3312960	So why didn't this happen? Because nobody in Kiev had the far side enough to say, okay, guys, listen, we have to build up,
3312960	3321960	we have to invest into our defense sector, we have to reform it on time and then let it start manufacturing new weaponry on time.
3321960	3332960	So nothing happened in these regards, actually, even as of, was it Autumn 2022, perhaps in Autumn the last year.
3332960	3340960	And therefore, you do not have serious production, you do not have new ballistic missiles, you do not have air-to-air missiles,
3340960	3350960	you do not have surface-to-air missiles, although your companies have ready to use designs for them and they could put them into production.
3350960	3357960	The next point is also that there is always this petty bickering about who is going to get the money for this.
3357960	3368960	You have advisors to the government who are complaining that Artyom and Luch, they are old and this is too complex and let's not give them money.
3368960	3377960	Let's get this stuff from the West, which is nonsensical. It would have been better to pay Artyom already back in 2022
3377960	3381960	to start manufacturing these new air-to-air missiles and surface-to-air missiles.
3381960	3388960	However, the government back then was convinced now this war is going to end, whatever, in the 6 months, 12 months or something.
3388960	3392960	Therefore, you did not launch production on time.
3392960	3401960	Even the Neptune anti-ship missile, which is meanwhile also developed as a cruise missile, was available on in prototype form.
3402960	3418960	Some 12 or 15 examples around in February 2022 and this first successful deployment against Russian guided missile cruiser Moskva was actually something like an ultimate test of the weapon.
3418960	3427960	Before that, there was no operational unit in the Ukrainian Armed Forces operating Neptune's.
3427960	3433960	And ever since, how many are manufactured? 15 perhaps a year.
3433960	3446960	15 a year, where you could need actually, let's say at least 500 of them and probably then develop them into land attack versions, which could be launched from Asia 24.
3446960	3455960	So you don't need to beg Germans, British, French and the Americans for more storm shadows and similar stuff.
3455960	3458960	You could have had all of this already years ago.
3458960	3465960	Your government just failed to reorganize the defense sector to finance it properly to launch the production.
3465960	3472960	Right now, your defense sector is working with 40 to 60% of its capacity.
3472960	3482960	Which means actually that people are sitting there and working something like, let's say, 4 to 5 hours a day instead of 8 hours a day in 3 shifts.
3482960	3493960	This is insane. You're facing a war of extermination and your defense sector is sitting there and waiting for better times.
3493960	3502960	Because there's nobody in Kiev capable of reorganizing the financing of the sector and then the management of the sector itself.
3502960	3504960	Nothing is happening.
3504960	3515960	There are always big announcements, but until somebody from the West comes in, pays a lot of money probably somewhere and then invests a lot of money into one or the other factory, nothing happens.
3515960	3521960	And that is why you don't have modern air-to-air missiles for your suhuis and for your mix.
3521960	3524960	And why you don't have enough surface-to-air missiles.
3524960	3536960	And why, therefore, the entire production and the entire defense sector, its future functionality is under a big question mark.
3536960	3542960	Thank you, Tom, for such comprehensive explanation of our situation.
3542960	3545960	A few questions left.
3545960	3552960	The last one from this section is about Russian and Iranian trade.
3552960	3562960	Everyone in Ukraine knows that Russia buys Shahads and ballistic missiles and everything else from Iran.
3562960	3570960	From time to time, you're expressing your doubts about the actual amount of such military trade.
3570960	3573960	Could you please share with us your thoughts?
3573960	3576960	There is no alliance between Russia and Iran.
3576960	3584960	There's a relation between a customer and seller.
3584960	3590960	And there's lots of rivalry and lots of mistrust, especially from Iranians.
3590960	3595960	So all these stories about ballistic missiles, where are they?
3596960	3600960	I haven't seen any kind of Iranian ballistic missiles in Russia yet.
3600960	3603960	Because we already destroyed all of them.
3603960	3604960	Of course.
3604960	3606960	A few weeks ago.
3606960	3612960	You have even destroyed the secret depots where they were stored, you know?
3612960	3613960	Okay, seriously now.
3613960	3618960	There are no ballistic missiles in Iran, ballistic missiles in Russia.
3618960	3622960	Except they have delivered them the last five days, say.
3622960	3624960	It's not going to happen.
3624960	3628960	And for a simple reason that the Iranians do not trust the Russians.
3628960	3632960	I mean, study a little bit the history of Russia and Iran and their rivalry.
3632960	3639960	And you're going to see that they hate each other almost like Ukrainians and Russians are hating each other nowadays.
3639960	3650960	So, and then check the history of the last 20, 30 years and all the repeated attempts of Tehran to buy major weapons systems from Russia.
3650960	3660960	And every single one, almost every single one was screwed up, excuse me, for his passion in one way or the other by the Russians.
3660960	3669960	And then you have the situation in the Caspian Sea, where the Iranians would like to bring in their ships for exploration of gas and oil.
3669960	3676960	They know that it is there at the bottom of the sea, but they cannot bring their ships to explore it, to find it.
3676960	3683960	And to start drilling for it and exploiting it because the Russians wouldn't let them do so.
3683960	3688960	You cannot bring such a ship. These are big ships. They are very wide. They're very heavy.
